{
  "id": "kruskal",
  "title": "크루스칼 최소 신장 트리",
  "summary": "간선을 가중치 순으로 훑으며 사이클을 만들지 않는 것만 골라 최소 신장 트리를 만든다.",
  "aliases": ["크루스칼", "kruskal", "MST", "최소신장트리", "최소 스패닝 트리", "union find", "유니온 파인드"],
  "categories": ["graph", "greedy"],
  "dataStructures": ["graph"],
  "complexity": {
    "time": { "best": "O(E log E)", "avg": "O(E log E)", "worst": "O(E log E)" },
    "space": "O(V)"
  },
  "difficulty": "intermediate",
  "tags": ["mst", "greedy", "union-find", "weighted", "cut-property"],
  "languages": ["cpp"],
  "generation": ["model-a"],
  "path": "algorithms/kruskal/"
}
