{
  "id": "insertion-sort",
  "title": "삽입 정렬",
  "summary": "앞쪽 정렬된 구간에 원소를 하나씩 알맞은 자리에 끼워 넣는 정렬.",
  "aliases": [
    "삽입정렬",
    "insertion sort",
    "insertionsort"
  ],
  "categories": [
    "sorting"
  ],
  "dataStructures": [
    "array"
  ],
  "complexity": {
    "time": {
      "best": "O(n)",
      "avg": "O(n^2)",
      "worst": "O(n^2)"
    },
    "space": "O(1)"
  },
  "difficulty": "beginner",
  "tags": [
    "comparison-sort",
    "in-place",
    "stable",
    "online",
    "incremental"
  ],
  "languages": [
    "cpp"
  ],
  "generation": [
    "model-a"
  ],
  "path": "algorithms/insertion-sort/"
}
